[
  {
    "file_name": "report.pdf",
    "file_type": "text/csv",
    "file_url": "https://sandbox.root.co.za/v1/files/download/5ec09f8a-5ff9-11e8-99c9-63fa045d8a15/report.pdf",
    "description": "Police Report",
    "created_at": "2018-05-25T08:55:27.600Z",
    "requested_by": {
      "id": "00000000-0000-0000-0000-000000000001",
      "type": "user"
    }
  }
]